[
  {
    "id": "victorian-steampunk",
    "era": "1860s-1910s",
    "title": "Victorian Steam Age Futures",
    "summary": "Industrial-era imagination of future technology powered by steam, brass mechanisms, imperial infrastructure, and hand-built ornament.",
    "influences": ["Jules Verne", "H.G. Wells", "Great Exhibition machinery", "Industrial Revolution engineering"],
    "visual_cues": ["exposed gear trains", "pressure gauges", "riveted boilers", "airship docks", "foggy gaslit boulevards"],
    "color_palette": ["#6A4E42", "#A97142", "#C6B38E", "#2F2A28", "#8A6D3B"],
    "materials": ["brass", "copper", "iron", "leather", "mahogany", "smoked glass"],
    "architecture": ["iron-and-glass arcades", "clocktower skylines", "catwalked factories", "railway termini"],
    "fashion": ["tailcoats", "goggles", "corsetry", "tool-belt harnesses", "mechanical prosthetic accents"],
    "shape_language": ["cylindrical pressure chambers", "radial gear spokes", "arched truss spans", "ornate bracket curves"],
    "pattern_systems": ["engraved filigree over machine housings", "Victorian wallpapers in control rooms", "serial-number stenciling"],
    "ornament_logic": ["functional ornament where bolts and trim coexist", "decorative etching on load-bearing metal"],
    "symbol_systems": ["nautical compass roses", "industrial hazard sigils", "clock dials as progress symbols"],
    "composition_rules": ["foreground machinery frame with atmospheric depth", "vertical towers puncture smoky horizon", "mechanism clusters lead eye diagonally"],
    "lighting_atmosphere": ["warm gaslight", "volumetric steam haze", "ember-like furnace glow"],
    "typography_graphics": ["engraver serif signage", "Victorian poster borders", "technical plate labels"],
    "common_subjects": ["airship ports", "submersible labs", "steam mechs", "inventor workshops"],
    "regional_variants": ["British imperial docklands", "French Belle Époque scientific salons", "American frontier rail-steam hybridity"],
    "historical_context": ["response to rapid mechanization", "utopian and colonial anxieties mixed", "fictionalized patent-age innovation"],
    "modern_reinterpretation": ["maker culture props", "eco-steam fantasy with renewable boilers", "luxury brass interior styling"],
    "adjacent_styles": ["neo-Victorian", "clockpunk", "gothic revival"],
    "prompt_tokens": ["steampunk", "ornate victorian engineering", "brass machinery", "airship docks", "cinematic fog"],
    "negative_tokens": ["cyberpunk neon", "touchscreen UI", "smooth white minimalism"],
    "usage_notes": ["Anchor scenes with believable pressure systems", "Pair ornament with visible mechanical function"],
    "source_notes": ["Use for warm, tactile retro-industrial scenes."]
  },
  {
    "id": "raygun-gothic",
    "era": "1930s-1950s",
    "title": "Raygun Gothic Pulp Future",
    "summary": "Pre-spaceflight pulp visions of planets, ray weapons, and heroic adventure rendered with theatrical optimism and speculative absurdity.",
    "influences": ["Amazing Stories covers", "Buck Rogers serials", "Flash Gordon comics", "planetary romance illustration"],
    "visual_cues": ["bubble helmets", "finned rockets", "ray pistols", "alien skyline silhouettes", "painted nebula backdrops"],
    "color_palette": ["#F94144", "#F3722C", "#F9C74F", "#577590", "#1D3557"],
    "materials": ["painted tin", "riveted aluminum", "clear acrylic domes", "vinyl costumes"],
    "architecture": ["moon domes", "retro launch gantries", "planetary palaces", "radial command hubs"],
    "fashion": ["high-collar jumpsuits", "cape-like uniforms", "antenna helmets", "contrast piping"],
    "shape_language": ["tear-drop rockets", "spherical observatories", "spiky alien ornament"],
    "pattern_systems": ["chevron speed stripes", "starfield gradients", "comic halftone explosions"],
    "ornament_logic": ["dramatic trim over practical detail", "heroic insignia enlarged for readability"],
    "symbol_systems": ["planet-ring emblems", "ray burst icons", "space fleet badges"],
    "composition_rules": ["dynamic low angles on heroes", "strong silhouette readability", "high contrast against cosmic sky"],
    "lighting_atmosphere": ["saturated key colors", "stage-like rim lights", "painted cosmic glow"],
    "typography_graphics": ["pulp display lettering", "explosive word balloons", "serial chapter cards"],
    "common_subjects": ["planetary duels", "retro rocket launch", "alien throne rooms", "interstellar rescue scenes"],
    "regional_variants": ["US pulp magazine variant", "Italian comic opera-space look", "Soviet adventure print parallels"],
    "historical_context": ["mass media escapism during depression and war eras", "scientific curiosity without engineering realism"],
    "modern_reinterpretation": ["camp sci-fi posters", "theme-park retro space branding", "indie comic revivals"],
    "adjacent_styles": ["atompunk", "space opera kitsch", "retro comic art"],
    "prompt_tokens": ["raygun gothic", "pulp space opera", "painted alien sky", "retro hero composition"],
    "negative_tokens": ["hard-sci-fi realism", "modern EVA suits", "photoreal cockpit UI"],
    "usage_notes": ["Favor icon clarity over engineering plausibility", "Use theatrical poses and high saturation"],
    "source_notes": ["Best for cinematic pulp adventure imagery."]
  },
  {
    "id": "dieselpunk-interwar",
    "era": "1920s-1940s",
    "title": "Interwar Diesel Age Tomorrow",
    "summary": "Machine-age optimism and anxiety rendered through aerodynamic metal design, propaganda graphics, militarized silhouettes, and colossal civic infrastructure.",
    "influences": ["Art Deco", "Bauhaus", "Italian Futurism", "golden-age pulp magazine illustration"],
    "visual_cues": ["streamlined locomotives", "zeppelin moorings", "monumental terminals", "mechanized uniforms", "smokestack skylines"],
    "color_palette": ["#2A2E35", "#9CA3AF", "#D9D1C1", "#B23A2C", "#6F7C6B"],
    "materials": ["steel", "concrete", "chrome", "bakelite", "oil-stained leather"],
    "architecture": ["Art Deco towers", "aerodromes", "triumphal civic plazas", "mega-factories"],
    "fashion": ["double-breasted coats", "aviator helmets", "military tailoring", "industrial boots"],
    "shape_language": ["streamline teardrops", "stacked ziggurat masses", "armored plate volumes"],
    "pattern_systems": ["sunburst Deco radiants", "industrial warning chevrons", "posterized diagonal grids"],
    "ornament_logic": ["reduced geometric ornament", "monumental relief symbols integrated into architecture"],
    "symbol_systems": ["wings and gears", "state emblems", "production quota posters"],
    "composition_rules": ["hero scale against massive structures", "triangular propaganda framing", "smoke plumes used as depth planes"],
    "lighting_atmosphere": ["overcast metallic daylight", "searchlights", "hard contrast spot illumination"],
    "typography_graphics": ["Deco sans-serif titling", "constructivist poster blocks", "stencil serial marks"],
    "common_subjects": ["airship terminals", "armored trains", "industrial expositions", "diesel city boulevards"],
    "regional_variants": ["French/US deco glamour", "German industrial severity", "Soviet constructivist futurism"],
    "historical_context": ["interwar modernization drives", "mass production as ideology", "mechanized conflict premonition"],
    "modern_reinterpretation": ["alternate-history games", "neo-deco transit branding", "dark academia industrial visuals"],
    "adjacent_styles": ["atompunk", "decofuturism", "military retro-modernism"],
    "prompt_tokens": ["dieselpunk", "art deco futurism", "streamlined machines", "epic matte painting", "vintage grain"],
    "negative_tokens": ["postmodern glass", "LED signage", "contemporary streetwear"],
    "usage_notes": ["Keep infrastructure oversized and ideological", "Balance glamour and threat"],
    "source_notes": ["Great for dramatic, metallic, and monumental settings."]
  },
  {
    "id": "atompunk-space-age",
    "era": "1950s-1960s",
    "title": "Atomic Space Age Optimism",
    "summary": "Mid-century visions of tomorrow featuring atom motifs, domestic automation, cheerful corporate futurism, and early space race enthusiasm.",
    "influences": ["Googie architecture", "Jet Age advertising", "World's Fair concept art", "space race graphics"],
    "visual_cues": ["boomerang forms", "starbursts", "bubble helmets", "rocket fins", "atomic symbols"],
    "color_palette": ["#5CC8FF", "#FF6F61", "#F9D65C", "#FFFFFF", "#1B4965"],
    "materials": ["fiberglass", "aluminum", "plastic laminate", "chrome", "vinyl"],
    "architecture": ["Googie diners", "cantilevered roofs", "futuristic suburbs", "airport lounges"],
    "fashion": ["mod dresses", "sleek jumpsuits", "cat-eye sunglasses", "clean lab uniforms"],
    "shape_language": ["boomerangs", "sputnik spheres", "pinched waist silhouettes", "tail-fin wedges"],
    "pattern_systems": ["starburst repeats", "kidney-bean geometry", "constellation wallpaper prints"],
    "ornament_logic": ["light decorative motifs on clean surfaces", "symbolic atom marks replacing heavy ornament"],
    "symbol_systems": ["atomic orbital icons", "household automation badges", "rocket-age civic logos"],
    "composition_rules": ["bright foreground object as icon", "open sky and optimistic horizon", "clean negative space with one focal motif"],
    "lighting_atmosphere": ["high-key daylight", "commercial studio lighting", "clean glossy reflections"],
    "typography_graphics": ["script + geometric sans mixes", "travel poster typography", "advertising bursts"],
    "common_subjects": ["space-age kitchens", "suburban launch pads", "family-friendly space tourism", "research campuses"],
    "regional_variants": ["US suburban atompunk", "Soviet cosmic modernism", "Brazilian modernist tropical adaptation"],
    "historical_context": ["post-war consumer optimism", "nuclear-age fascination", "public science education boom"],